{
  "input": {
    "folder": "salla-mono-lite",
    "assets": ["assets/style.css", "assets/app.js"]
  },
  "parsed": {
    "sections": [
      {
        "page": "index.html",
        "componentCount": 1,
        "sharedComponents": [],
        "unchanged": false
      }
    ],
    "components": [
      {
        "id": "dcef8ad9",
        "selector": "section",
        "signature": "mono",
        "page": "index.html",
        "shared": false,
        "order": 0,
        "classes": "mono"
      }
    ],
    "conflicts": [],
    "assets": ["assets/style.css", "assets/app.js"],
    "cssMapSample": {
      "index.html": {}
    },
    "templateHints": [
      {
        "page": "index.html",
        "hints": []
      }
    ],
    "confidence": 0,
    "semanticStats": {
      "placeholdersApplied": 0,
      "bareTokensApplied": 0,
      "i18nNodesWrapped": 0,
      "i18nAttributesWrapped": 0,
      "sanitizedInlineHandlers": 0,
      "blockedExternalScripts": 0
    }
  },
  "adapted": {
    "twig": [],
    "metadata": {}
  },
  "validated": {
    "status": "pass",
    "warnings": [],
    "errors": [],
    "counts": {
      "warnings": 0,
      "errors": 0
    }
  }
}
